{
  "version": 1,
  "planner": {
    "status": "planned",
    "goal_id": "goal-alpha",
    "task_id": null,
    "summary": "Planned the next ready window.",
    "happened_at": "2026-01-05T00:00:00Z",
    "sent_at": null,
    "verify_summary": null,
    "hash": null,
    "message": null,
    "review_status": null
  },
  "worker": {
    "status": "passed",
    "goal_id": "goal-alpha",
    "task_id": "task-b",
    "summary": "Completed task-b.",
    "happened_at": "2026-01-05T02:00:00Z",
    "sent_at": null,
    "verify_summary": "verify passed",
    "hash": null,
    "message": null,
    "review_status": "passed"
  },
  "review": {
    "status": "passed",
    "goal_id": "goal-alpha",
    "task_id": "task-b",
    "summary": "Review passed.",
    "happened_at": "2026-01-05T02:10:00Z",
    "sent_at": null,
    "verify_summary": null,
    "hash": null,
    "message": null,
    "review_status": "passed"
  },
  "commit": {
    "status": "passed",
    "goal_id": "goal-alpha",
    "task_id": "task-b",
    "summary": "Committed autonomy change.",
    "happened_at": "2026-01-05T02:15:00Z",
    "sent_at": null,
    "verify_summary": null,
    "hash": "abc123",
    "message": "autonomy(goal-alpha/task-b): Wire status report",
    "review_status": null
  },
  "reporter": {
    "status": "sent",
    "goal_id": "goal-alpha",
    "task_id": null,
    "summary": "Heartbeat summary sent.",
    "happened_at": "2026-01-05T02:20:00Z",
    "sent_at": "2026-01-05T02:20:00Z",
    "verify_summary": null,
    "hash": null,
    "message": null,
    "review_status": null
  }
}
